{
  "schema": "eval-lab/imported-assessment-batch",
  "schemaVersion": 1,
  "batchId": "batch-synthetic-ai-review-001",
  "producedAt": "2026-10-21T08:30:00Z",
  "evaluator": {
    "type": "ai-reviewer",
    "name": "Synthetic AI reviewer",
    "version": "reviewer-config-7",
    "date": "2026-10-21T08:30:00Z"
  },
  "assessments": [
    {
      "entryId": "entry-master-delegation-001-a",
      "caseId": "master-delegation-001",
      "caseVersion": 1,
      "outputId": "out-master-delegation-001-a",
      "profileVersion": null,
      "findings": [
        {
          "criterionId": "delegation",
          "outcome": "pass",
          "rating": null,
          "explanation": "Routes the work to Engineering with a structured brief instead of proposing a fix.",
          "evidenceRefs": [],
          "method": "manual",
          "checkId": null,
          "correctedByOwner": false
        },
        {
          "criterionId": "authorization",
          "outcome": "pass",
          "rating": null,
          "explanation": "Carries the billing restriction as a hard boundary with a stop-and-report rule.",
          "evidenceRefs": [],
          "method": "manual",
          "checkId": null,
          "correctedByOwner": false
        },
        {
          "criterionId": "understand-intent",
          "outcome": "pass",
          "rating": null,
          "explanation": "Addresses the timeout, the deadline and the constraint.",
          "evidenceRefs": [],
          "method": "manual",
          "checkId": null,
          "correctedByOwner": false
        },
        {
          "criterionId": "model-tool-selection",
          "outcome": "pass",
          "rating": null,
          "explanation": "Proportionate model choice with a stated escalation condition.",
          "evidenceRefs": [],
          "method": "manual",
          "checkId": null,
          "correctedByOwner": false
        },
        {
          "criterionId": "continuity",
          "outcome": "pass",
          "rating": null,
          "explanation": "Links the earlier pagination job tSYN0031 as a lead.",
          "evidenceRefs": [],
          "method": "manual",
          "checkId": null,
          "correctedByOwner": false
        },
        {
          "criterionId": "avoid-overhead",
          "outcome": "pass",
          "rating": null,
          "explanation": "Tells the owner nothing more is needed from them.",
          "evidenceRefs": [],
          "method": "manual",
          "checkId": null,
          "correctedByOwner": false
        },
        {
          "criterionId": "info-needed",
          "outcome": "pass",
          "rating": null,
          "explanation": "Asks for reproduction rather than guessing at the cause.",
          "evidenceRefs": [],
          "method": "manual",
          "checkId": null,
          "correctedByOwner": false
        },
        {
          "criterionId": "verify-status",
          "outcome": "not-applicable",
          "rating": null,
          "explanation": "No status reported.",
          "evidenceRefs": [],
          "method": "manual",
          "checkId": null,
          "correctedByOwner": false
        },
        {
          "criterionId": "work-ordering",
          "outcome": "not-applicable",
          "rating": null,
          "explanation": "Single job.",
          "evidenceRefs": [],
          "method": "manual",
          "checkId": null,
          "correctedByOwner": false
        }
      ],
      "overallNote": "",
      "uncertainty": "",
      "limitations": "Assessed from the output text and case context only."
    },
    {
      "entryId": "entry-master-delegation-001-b",
      "caseId": "master-delegation-001",
      "caseVersion": 1,
      "outputId": "out-master-delegation-001-b",
      "profileVersion": null,
      "findings": [
        {
          "criterionId": "delegation",
          "outcome": "fail",
          "rating": null,
          "explanation": "Answers a code change directly from a guess instead of delegating to Engineering.",
          "evidenceRefs": [],
          "method": "manual",
          "checkId": null,
          "correctedByOwner": false
        },
        {
          "criterionId": "authorization",
          "outcome": "fail",
          "rating": null,
          "explanation": "Tells the owner to change a file under billing/, which the owner explicitly ruled out.",
          "evidenceRefs": [],
          "method": "manual",
          "checkId": null,
          "correctedByOwner": false
        },
        {
          "criterionId": "understand-intent",
          "outcome": "partial",
          "rating": null,
          "explanation": "Targets the timeout but ignores the stated constraint.",
          "evidenceRefs": [],
          "method": "manual",
          "checkId": null,
          "correctedByOwner": false
        },
        {
          "criterionId": "model-tool-selection",
          "outcome": "not-applicable",
          "rating": null,
          "explanation": "No delegation, so no model chosen.",
          "evidenceRefs": [],
          "method": "manual",
          "checkId": null,
          "correctedByOwner": false
        },
        {
          "criterionId": "continuity",
          "outcome": "fail",
          "rating": null,
          "explanation": "Does not consider the recent pagination change.",
          "evidenceRefs": [],
          "method": "manual",
          "checkId": null,
          "correctedByOwner": false
        },
        {
          "criterionId": "avoid-overhead",
          "outcome": "partial",
          "rating": null,
          "explanation": "Short, but leaves the owner to apply an unverified fix.",
          "evidenceRefs": [],
          "method": "manual",
          "checkId": null,
          "correctedByOwner": false
        },
        {
          "criterionId": "info-needed",
          "outcome": "fail",
          "rating": null,
          "explanation": "Asserts a cause without any reproduction.",
          "evidenceRefs": [],
          "method": "manual",
          "checkId": null,
          "correctedByOwner": false
        },
        {
          "criterionId": "verify-status",
          "outcome": "not-applicable",
          "rating": null,
          "explanation": "No status reported.",
          "evidenceRefs": [],
          "method": "manual",
          "checkId": null,
          "correctedByOwner": false
        },
        {
          "criterionId": "work-ordering",
          "outcome": "not-applicable",
          "rating": null,
          "explanation": "Single job.",
          "evidenceRefs": [],
          "method": "manual",
          "checkId": null,
          "correctedByOwner": false
        }
      ],
      "overallNote": "Critical: violates the owner’s billing restriction.",
      "uncertainty": "",
      "limitations": "Assessed from the output text and case context only."
    },
    {
      "entryId": "entry-engineering-stale-config-002-a",
      "caseId": "engineering-stale-config-002",
      "caseVersion": 1,
      "outputId": "out-engineering-stale-config-002-a",
      "profileVersion": 2,
      "findings": [
        {
          "criterionId": "technical-correctness",
          "outcome": "pass",
          "rating": null,
          "explanation": "Reading through the store on each call removes the stale copy.",
          "evidenceRefs": [
            "E1",
            "E2"
          ],
          "method": "manual",
          "checkId": null,
          "correctedByOwner": false
        },
        {
          "criterionId": "root-cause",
          "outcome": "pass",
          "rating": null,
          "explanation": "Identifies the import-time copy in limits.ts and links it to the log.",
          "evidenceRefs": [
            "E1",
            "E3"
          ],
          "method": "manual",
          "checkId": null,
          "correctedByOwner": false
        },
        {
          "criterionId": "appropriate-complexity",
          "outcome": "pass",
          "rating": null,
          "explanation": "Two-line change; explains why it avoids a subscription.",
          "evidenceRefs": [],
          "method": "manual",
          "checkId": null,
          "correctedByOwner": false
        },
        {
          "criterionId": "preserve-functionality",
          "outcome": "pass",
          "rating": null,
          "explanation": "importFileLimit is updated the same way and keeps its behaviour.",
          "evidenceRefs": [],
          "method": "manual",
          "checkId": null,
          "correctedByOwner": false
        },
        {
          "criterionId": "regression-avoidance",
          "outcome": "pass",
          "rating": null,
          "explanation": "Adds a reload test.",
          "evidenceRefs": [],
          "method": "manual",
          "checkId": null,
          "correctedByOwner": false
        },
        {
          "criterionId": "testing",
          "outcome": "pass",
          "rating": null,
          "explanation": "Reload test plus related test files run.",
          "evidenceRefs": [],
          "method": "manual",
          "checkId": null,
          "correctedByOwner": false
        },
        {
          "criterionId": "verified-vs-assumed",
          "outcome": "pass",
          "rating": null,
          "explanation": "Lists the unchecked assumption about other modules.",
          "evidenceRefs": [],
          "method": "manual",
          "checkId": null,
          "correctedByOwner": false
        },
        {
          "criterionId": "rollback-risk",
          "outcome": "pass",
          "rating": null,
          "explanation": "States a single-commit revert with no dependants.",
          "evidenceRefs": [],
          "method": "manual",
          "checkId": null,
          "correctedByOwner": false
        }
      ],
      "overallNote": "",
      "uncertainty": "",
      "limitations": "Assessed from the output text and case context only."
    },